{
  "schema_version": "1.0",
  "episode_id": "episode_20260917T060718354486Z_9a476163",
  "created_at": "2026-09-17T06:07:18.354486+00:00",
  "stage": "v2",
  "task": "Reach a Cartesian target while preserving the Panda hand orientation.",
  "observation": {
    "robot": "franka_emika_panda",
    "target_position": [
      0.45,
      0.15,
      0.55
    ]
  },
  "goal": {
    "position_error_m_max": 0.02,
    "orientation_error_rad_max": 0.03
  },
  "candidate_plans": [
    {
      "plan": {
        "plan_id": "pose_low_damping",
        "damping": 0.01,
        "max_iterations": 300
      },
      "converged": true,
      "iterations": 8,
      "position_error_m": 0.005344563093998659,
      "orientation_error_rad": 0.012137349314549949,
      "joint_limit_violations": 0,
      "target_qpos": [
        0.1330110402973781,
        -0.27927429292955075,
        0.16580429718160525,
        -2.063642530614369,
        0.04661023249281449,
        1.7877767092029262,
        -0.5028394405891801
      ],
      "score": 96.72085098727317
    },
    {
      "plan": {
        "plan_id": "pose_balanced_damping",
        "damping": 0.05,
        "max_iterations": 300
      },
      "converged": true,
      "iterations": 8,
      "position_error_m": 0.005333167232176984,
      "orientation_error_rad": 0.012143229948998425,
      "joint_limit_violations": 0,
      "target_qpos": [
        0.1339040205405881,
        -0.27926334238754424,
        0.16499806877233641,
        -2.0636427292520976,
        0.046379138351545016,
        1.7877502656624407,
        -0.5026731666483764
      ],
      "score": 96.72625488646159
    },
    {
      "plan": {
        "plan_id": "pose_high_damping",
        "damping": 0.15,
        "max_iterations": 300
      },
      "converged": true,
      "iterations": 12,
      "position_error_m": 0.005323279598748444,
      "orientation_error_rad": 0.01215785409320761,
      "joint_limit_violations": 0,
      "target_qpos": [
        0.13925954043456895,
        -0.27886990136447704,
        0.16033644150389847,
        -2.063462308364724,
        0.045016163275301925,
        1.7877678077458787,
        -0.5014952632102477
      ],
      "score": 96.73046749596539
    }
  ],
  "decision": {
    "selected_plan_id": "pose_high_damping",
    "reason": "Highest objective 6D execution score.",
    "predicted_evaluation": {
      "plan": {
        "plan_id": "pose_high_damping",
        "damping": 0.15,
        "max_iterations": 300
      },
      "converged": true,
      "iterations": 12,
      "position_error_m": 0.005323279598748444,
      "orientation_error_rad": 0.01215785409320761,
      "joint_limit_violations": 0,
      "target_qpos": [
        0.13925954043456895,
        -0.27886990136447704,
        0.16033644150389847,
        -2.063462308364724,
        0.045016163275301925,
        1.7877678077458787,
        -0.5014952632102477
      ],
      "score": 96.73046749596539
    }
  },
  "execution": {
    "target_qpos": [
      0.13925954043456895,
      -0.27886990136447704,
      0.16033644150389847,
      -2.063462308364724,
      0.045016163275301925,
      1.7877678077458787,
      -0.5014952632102477
    ]
  },
  "result": {
    "final_state": {},
    "objective_evaluation": {
      "plan": {
        "plan_id": "pose_high_damping",
        "damping": 0.15,
        "max_iterations": 300
      },
      "converged": true,
      "iterations": 12,
      "position_error_m": 0.005323279598748444,
      "orientation_error_rad": 0.01215785409320761,
      "joint_limit_violations": 0,
      "target_qpos": [
        0.13925954043456895,
        -0.27886990136447704,
        0.16033644150389847,
        -2.063462308364724,
        0.045016163275301925,
        1.7877678077458787,
        -0.5014952632102477
      ],
      "score": 96.73046749596539
    },
    "user_evaluation": null
  },
  "reflection": {
    "success_factors": [
      "Matched world-frame orientation error to MuJoCo angular Jacobian."
    ],
    "failure_causes": [],
    "learned": "Quaternion error must be expressed in the Jacobian frame before DLS.",
    "next_experiment": "Evaluate pose targets and reject obstacle-contacting paths.",
    "confidence": 0.8,
    "unresolved_questions": [
      "How robust is 6D reach across the workspace?"
    ]
  },
  "sources": [
    "research/research_20260917_panda_model.json"
  ],
  "skills_used": [
    "v2.panda_pose_reach"
  ]
}
