{
  "schema_version": "1.0",
  "episode_id": "episode_20260917T062511240470Z_d03b9c29",
  "created_at": "2026-09-17T06:25:11.240470+00:00",
  "stage": "v2",
  "task": "Detect and recover from a deliberately missed grasp in sandbox.",
  "observation": {
    "initial_attempt": {
      "plan": {
        "plan_id": "grasp_high",
        "grasp_hand_z": 0.395
      },
      "initial_object_z": 0.335,
      "final_object_z": 0.33136282378312426,
      "lift_height_m": -0.0036371762168757593,
      "final_object_to_hand_distance_m": 0.25946843250340174,
      "forbidden_contact_steps": 5512,
      "stable": true,
      "success": false,
      "score": -11029.553086271755
    }
  },
  "goal": {
    "diagnose_failure": true,
    "recovery_success": true
  },
  "candidate_plans": [
    {
      "plan": "retry_validated_low_grasp",
      "reset_based": true
    }
  ],
  "decision": {
    "selected_plan_id": "retry_validated_low_grasp",
    "reason": "Missed-grasp metrics match prior failure evidence.",
    "predicted_evaluation": {
      "diagnosis": {
        "failure_type": "missed_grasp",
        "evidence": [
          "lift_height_m=-0.003637<0.08",
          "retention_distance_m=0.259468>0.16",
          "forbidden_contact_steps=5512>0"
        ],
        "confidence": 0.95
      }
    }
  },
  "execution": {
    "recovery_attempt": {
      "plan": {
        "plan_id": "grasp_low",
        "grasp_hand_z": 0.375
      },
      "initial_object_z": 0.335,
      "final_object_z": 0.47129926482280476,
      "lift_height_m": 0.13629926482280474,
      "final_object_to_hand_distance_m": 0.09839807696707702,
      "forbidden_contact_steps": 0,
      "stable": true,
      "success": true,
      "score": 111.66196494293892
    }
  },
  "result": {
    "final_state": {},
    "objective_evaluation": {
      "recovered": true,
      "reset_based": true
    },
    "user_evaluation": null
  },
  "reflection": {
    "success_factors": [
      "Objective failure classification selected a previously validated alternative."
    ],
    "failure_causes": [
      "High grasp pose did not retain or lift the object."
    ],
    "learned": "Reset-based sandbox retry works but does not prove online recovery.",
    "next_experiment": "Recover in the same world from the observed post-failure object pose.",
    "confidence": 0.9,
    "unresolved_questions": [
      "How should object pose be reacquired after failure?"
    ]
  },
  "sources": [],
  "skills_used": [
    "v2.panda_grasp_lift"
  ]
}
