{
  "schema_version": "1.0",
  "episode_id": "episode_20260917T062218862297Z_e44594ea",
  "created_at": "2026-09-17T06:22:18.862297+00:00",
  "stage": "v2",
  "task": "Evaluate pick-and-place across object and scene variation.",
  "observation": {
    "scenario_count": 6,
    "varied": [
      "size",
      "density",
      "friction",
      "source",
      "target"
    ]
  },
  "goal": {
    "first_attempt_success_rate_min": 0.8,
    "final_xy_error_m_max": 0.05
  },
  "candidate_plans": [
    {
      "scenario": "nominal",
      "selected": "place_high"
    },
    {
      "scenario": "small_light",
      "selected": "place_high"
    },
    {
      "scenario": "small_heavy",
      "selected": "place_high"
    },
    {
      "scenario": "wide",
      "selected": "place_high"
    },
    {
      "scenario": "tall",
      "selected": "place_centered"
    },
    {
      "scenario": "low_friction",
      "selected": "place_high"
    }
  ],
  "decision": {
    "selected_plan_id": "per-scenario-full-future-selection",
    "reason": "Each scenario selects among full pick-place futures.",
    "predicted_evaluation": {
      "success_rate": 1.0,
      "max_error": 0.02224597326448327
    }
  },
  "execution": {
    "raw_result": "experiments/0009_v2_manipulation_variation.results.json"
  },
  "result": {
    "final_state": {},
    "objective_evaluation": {
      "success_count": 6,
      "trial_count": 6,
      "success_rate": 1.0,
      "mean_final_xy_error_m": 0.009144838683636799,
      "max_final_xy_error_m": 0.02224597326448327
    },
    "user_evaluation": null
  },
  "reflection": {
    "success_factors": [
      "Full candidate simulation reused model-derived reach and grasp evidence."
    ],
    "failure_causes": [],
    "learned": "The baseline generalized across the declared moderate variation suite.",
    "next_experiment": "Add recovery from deliberate grasp and placement failures.",
    "confidence": 0.9,
    "unresolved_questions": [
      "How should FDB recover after a dropped object?"
    ]
  },
  "sources": [
    "research/research_20260917_panda_model.json"
  ],
  "skills_used": [
    "v2.panda_grasp_lift",
    "v2.panda_pick_place"
  ]
}
